{
  "pipeline": "URP",
  "palette": [
    {
      "name": "a closed palette",
      "hex": "#FF8C00",
      "role": null,
      "status": "tdd",
      "source": "tdd"
    }
  ],
  "budgets": {
    "platforms": [
      {
        "platform": "PC_Steam — reference (GTX 1060 6 GB / RX 580 8 GB, i5-8400)",
        "resolution": [
          1920,
          1080
        ],
        "fps": 60,
        "frame_ms": 16.6,
        "memory": "8 GB RAM · 3 GB VRAM"
      },
      {
        "platform": "PC_Steam — Steam Deck",
        "resolution": [
          1280,
          800
        ],
        "fps": 60,
        "frame_ms": 16.6,
        "memory": "16 GB shared (game ≤ 4 GB)"
      },
      {
        "platform": "Console_Ready (PS5 / Xbox Series proxy)",
        "resolution": [
          1920,
          1080
        ],
        "fps": 60,
        "frame_ms": 16.6,
        "memory": "4 GB game budget"
      }
    ],
    "draw_calls_max": null,
    "particles_max": null
  },
  "post": [
    "bloom",
    "depth-of-field",
    "color-grading",
    "tonemapping"
  ]
}
